{"input": "{config}/input/badges.xlsx", "output": "{config}/output", "profileImages": "{config}/images/profile", "title": "Example Dashboard", "header": "Look at these nice badges...", "ignoreMissingImages": false, "showUnassignedBadges": false, "showProfileImages": true, "blacklist": [], "badges": [{"name": "Start Badge", "image": "{config}/images/badge/Start Badge.png", "levels": [{"name": "Start Badge #2", "image": "{config}/images/badge/Start Badge_1.png", "n": 5}, {"name": "Start Badge #3", "image": "{config}/images/badge/Start Badge_2.png", "n": 10}, {"name": "Start Badge #4", "image": "{config}/images/badge/Start Badge_3.png", "n": 15}, {"name": "Start Badge #5", "image": "{config}/images/badge/Start Badge_4.png", "n": 20}]}]}