{
    "input": "{config}/input/**/*.xlsx",
    "output": "{config}/output",
    "badges": [
        {
            "name": "Idea Pool Presenter",
            "levels": [
                {
                    "name": "Idea Pool Contributor",
                    "n": 5,
                    "image": "{config}/images/badge/idea-pool-contributor.png"
                },
                {
                    "name": "Idea Pool Professional",
                    "n": 10,
                    "image": "{config}/images/badge/idea-pool-professional.png"
                },
                {
                    "name": "Idea Pool Master",
                    "n": 20,
                    "image": "{config}/images/badge/idea-pool-master.png"
                },
                {
                    "name": "Idea Pool Jedi",
                    "n": 30,
                    "image": "{config}/images/badge/idea-pool-jedi.png"
                }
            ],
            "image": "{config}/images/badge/idea-pool-presenter.png"
        },
        {
            "name": "Idea Pool Active Member",
            "levels": [
                {
                    "name": "Idea Pool Lifetime Member",
                    "n": 5,
                    "image": "{config}/images/badge/idea-pool-lifetime-member.png"
                }
            ],
            "image": "{config}/images/badge/idea-pool-active-member.png"
        },
        {
            "name": "Thank you from Community!",
            "image": "{config}/images/badge/community-thank-you.png",
            "from": "Idea Pool Community"
        },
        {
            "name": "Community Active Contributor",
            "levels": [
                {
                    "name": "Community Active Contributor (Level 1)",
                    "image": "{config}/images/badge/community-active-contributor-2.png",
                    "n": 5
                },
                {
                    "name": "Community Active Contributor (Level 2)",
                    "image": "{config}/images/badge/community-active-contributor-3.png",
                    "n": 10
                },
                {
                    "name": "Community Active Contributor (Level 3)",
                    "image": "{config}/images/badge/community-active-contributor-4.png",
                    "n": 15
                }
            ],
            "image": "{config}/images/badge/community-active-contributor.png"
        }
    ],
    "profileImages": "{config}/images/profile",
    "ignoreMissingImages": true,
    "showUnassignedBadges": false,
    "showProfileImages": false,
    "title": "Idea Pool",
    "header": "We are proud to our top speakers!",
    "blacklist": [
        "Bhargavi Sriram",
        "Sowmya Surampalli",
        "Radhika Singh",
        "Prabhjot Dua",
        "Nishasingh Kushwaha"
    ]
}